{
  "schema_version": "1.0",
  "project_id": "yt-YP0FDR7Wc-8",
  "report_type": "final",
  "decision": "FAIL",
  "metrics": {
    "languages": {
      "en": {
        "has_video": true,
        "has_audio": true,
        "container_ms": 1479746,
        "dub_ms": 1479746,
        "av_drift_ms": 0
      },
      "ar": {
        "has_video": true,
        "has_audio": true,
        "container_ms": 1487120,
        "dub_ms": 1483892,
        "av_drift_ms": 3228
      },
      "ur": {
        "has_video": true,
        "has_audio": true,
        "container_ms": 1478977,
        "dub_ms": 1478976,
        "av_drift_ms": 1
      },
      "zh": {
        "has_video": true,
        "has_audio": true,
        "container_ms": 1476407,
        "dub_ms": 1476407,
        "av_drift_ms": 0
      }
    },
    "av_align_tolerance_ms": 1000
  },
  "created_at": "2026-08-06T09:06:34Z",
  "created_by": "agent",
  "findings": [
    {
      "severity": "blocker",
      "category": "mux-av-misaligned",
      "summary": "[ar] audio ends 3228ms from the picture (tolerance 1000ms) — the dub is materially longer/shorter than the video.",
      "language": "ar"
    }
  ]
}
