{
  "schema_version": "1.0",
  "project_id": "yt-smoke0p3aa",
  "report_type": "glossary",
  "decision": "PASS",
  "metrics": {
    "glossary_id": "smoke-chan",
    "languages": {
      "en": {
        "required_occurrences": 1,
        "required_hits": 1,
        "required_hit_rate": 1.0,
        "preferred_misses": 0
      },
      "zh": {
        "required_occurrences": 1,
        "required_hits": 1,
        "required_hit_rate": 1.0,
        "preferred_misses": 0
      }
    }
  },
  "created_at": "2026-08-03T05:35:22Z",
  "created_by": "agent",
  "findings": []
}
