{
  "schema_version": "1.0",
  "project_id": "yt-smoke0p3aa",
  "report_type": "transcript-qa",
  "language": "fa",
  "artifact_hashes": [
    "sha256:31d9c456b33764ca006071680b63004e95a73360490737e4fb16a9e20abc6325"
  ],
  "decision": "PASS",
  "metrics": {
    "cue_count": 2,
    "low_confidence_cues": 0,
    "low_confidence_share": 0.0,
    "non_speech_cues": 0
  },
  "created_at": "2026-08-03T05:34:46Z",
  "created_by": "agent",
  "findings": [
    {
      "severity": "note",
      "category": "sensitive-political",
      "summary": "cue 0 references a sensitive political term ('انقلاب') — human editorial review of translation recommended",
      "cue_id": 0,
      "timestamp_ms": 0,
      "evidence": "سلام، من درباره انقلاب صحبت می‌کنم."
    }
  ]
}
