{
  "schema_version": "1.0",
  "project_id": "yt-MFuUIoF5PSc",
  "report_type": "translation-qa",
  "decision": "PASS",
  "metrics": {
    "languages": [
      "ar",
      "en",
      "es",
      "fr",
      "pt",
      "ru",
      "ur",
      "zh"
    ]
  },
  "created_at": "2026-08-08T23:34:59Z",
  "created_by": "agent",
  "findings": []
}
